{
  "profile": "MON_AUTHORED_FRAME_SOURCE_PACK_V1",
  "schema_version": 1,
  "pack_id": "00000000-0000-4000-8000-000000000405",
  "pack_revision": "synthetic-r04-c01-v1",
  "body_revision": "synthetic-geometric-v1",
  "developmental_stage": "synthetic",
  "approval_state": "synthetic_test_only",
  "approved_references": {"identity_sha256": "0000000000000000000000000000000000000000000000000000000000000000", "turnaround_sha256": "0000000000000000000000000000000000000000000000000000000000000000"},
  "provenance": {"art_authority": "synthetic", "generation_or_edit_method": "synthetic", "source_authority": "synthetic", "rights_record": "synthetic"},
  "timing": {"fps": 24, "tick_unit": "1/24_second"},
  "request_profile": "synthetic_r04_test_v1",
  "source_assets": [{"asset_id": "asset_test_pulse_000", "filename": "frames/test_pulse__front__neutral__v01__f000.png", "sha256": "0000000000000000000000000000000000000000000000000000000000000000"}],
  "tracks": [{
    "track_id": "synthetic:test_pulse:front:neutral:1", "family": "test_pulse", "selection_facing": "front", "entry_facing": "front", "exit_facing": "front", "posture": "neutral", "variant": 1, "entry_posture": "neutral", "exit_posture": "neutral", "completion": "once",
    "frames": [{
      "frame_id": "test_pulse_front_neutral_01_000", "frame_index": 0, "filename": "test_pulse__front__neutral__v01__f000.png", "sidecar_filename": "test_pulse__front__neutral__v01__f000.frame.json", "duration_ticks": 1, "source_asset_id": "asset_test_pulse_000", "source_sha256": "0000000000000000000000000000000000000000000000000000000000000000", "facing": "front", "posture": "neutral", "action_phase": "settle", "reuse_of": null,
      "landmarks": {
        "root": {"state": "visible", "point": {"x": 512, "y": 896}}, "ground_contact_left": {"state": "visible", "point": {"x": 480, "y": 896}}, "ground_contact_right": {"state": "visible", "point": {"x": 544, "y": 896}}, "head_center": {"state": "visible", "point": {"x": 512, "y": 320}}, "eye_midpoint": {"state": "visible", "point": {"x": 512, "y": 448}}, "eye_left": {"state": "visible", "point": {"x": 448, "y": 448}}, "eye_right": {"state": "visible", "point": {"x": 576, "y": 448}}, "mouth_center": {"state": "visible", "point": {"x": 512, "y": 520}}, "hand_left": {"state": "visible", "point": {"x": 280, "y": 560}}, "hand_right": {"state": "visible", "point": {"x": 744, "y": 560}}, "foot_left": {"state": "visible", "point": {"x": 480, "y": 896}}, "foot_right": {"state": "visible", "point": {"x": 544, "y": 896}}, "attachment_back": {"state": "visible", "point": {"x": 512, "y": 640}}, "attachment_front": {"state": "visible", "point": {"x": 512, "y": 600}}, "interaction_focus": {"state": "visible", "point": {"x": 512, "y": 448}}, "action_anchor": {"state": "visible", "point": {"x": 512, "y": 560}}, "object_anchor": {"state": "not_applicable", "point": null}
      },
      "provenance": {"authored_by": "synthetic", "method": "synthetic", "source_revision": "synthetic"}
    }],
    "contacts": [{"landmark": "ground_contact_left", "state": "planted", "start_tick": 0, "end_tick": 1}], "events": [{"event_id": "test_marker_001", "name": "test_marker", "tick": 0, "frame_index": 0}], "interruption_ranges": [{"start_tick": 0, "end_tick": 1}], "track_checksum": "0000000000000000000000000000000000000000000000000000000000000000"
  }]
}
